{
  "$schema": "http://json-schema.org/draft-07/schema#",
  "title": "Incantesimo SRD",
  "description": "Schema di validazione per una voce aggiunta a data/da_aggiungere_2014.json o data/da_aggiungere_2024.json. Ogni file è un array di oggetti conformi a questo schema, ognuno già completo: non sono ammessi campi vuoti o null salvo dove esplicitamente indicato.",
  "type": "array",
  "items": {
    "type": "object",
    "required": [
      "id", "nome", "livello", "edizione", "scuola", "tempo_lancio",
      "gittata", "durata", "rituale", "concentrazione", "comp",
      "materiali", "classi", "descrizione", "livelli_superiori"
    ],
    "additionalProperties": false,
    "properties": {
      "id": {
        "type": "string",
        "pattern": "^extra_[a-z0-9_]+$",
        "description": "Identificativo univoco, minuscolo, senza spazi o accenti, con prefisso extra_ (non srd_: questi incantesimi non provengono dal file SRD). Esempio: extra_deflagrazione_occulta_2014."
      },
      "nome": {
        "type": "string",
        "minLength": 1,
        "description": "Nome ufficiale italiano dell'incantesimo."
      },
      "livello": {
        "type": "integer",
        "minimum": 0,
        "maximum": 9,
        "description": "0 per i trucchetti, 1-9 per gli incantesimi di livello."
      },
      "edizione": {
        "type": "string",
        "enum": ["2014", "2024"]
      },
      "scuola": {
        "type": "string",
        "enum": [
          "Abiurazione", "Ammaliamento", "Divinazione", "Evocazione",
          "Illusione", "Invocazione", "Necromanzia", "Trasmutazione"
        ]
      },
      "tempo_lancio": { "type": "string", "minLength": 1 },
      "gittata": { "type": "string", "minLength": 1 },
      "durata": { "type": "string", "minLength": 1 },
      "rituale": { "type": "boolean" },
      "concentrazione": { "type": "boolean" },
      "comp": {
        "type": "object",
        "required": ["v", "s", "m"],
        "additionalProperties": false,
        "properties": {
          "v": { "type": "boolean" },
          "s": { "type": "boolean" },
          "m": { "type": "boolean" }
        }
      },
      "materiali": {
        "type": "string",
        "description": "Descrizione dei materiali richiesti. Stringa vuota se comp.m è false."
      },
      "classi": {
        "type": "array",
        "items": { "type": "string" },
        "minItems": 1,
        "description": "Elenco delle classi che possono lanciare l'incantesimo."
      },
      "descrizione": {
        "type": "string",
        "minLength": 1,
        "description": "Testo completo dell'effetto dell'incantesimo."
      },
      "livelli_superiori": {
        "type": "string",
        "description": "Testo del paragrafo \"Ai livelli superiori\". Stringa vuota se non applicabile."
      }
    }
  }
}
