[
  {
    "id": "extra_aiuto_2024",
    "nome": "Aiuto",
    "livello": 2,
    "edizione": "2024",
    "scuola": "Abiurazione",
    "tempo_lancio": "1 azione",
    "gittata": "9 metri",
    "durata": "8 ore",
    "rituale": false,
    "concentrazione": false,
    "comp": {
      "v": true,
      "s": true,
      "m": true
    },
    "materiali": "una minuscola striscia di tessuto bianco",
    "classi": [
      "Chierico",
      "Paladino"
    ],
    "descrizione": "Questo incantesimo rafforza il vigore e la determinazione degli alleati. L'incantatore sceglie fino a tre creature entro gittata. Il massimo dei punti ferita e i punti ferita attuali di ogni bersaglio aumentano di 5 per la durata dell'incantesimo.",
    "livelli_superiori": "Quando l'incantatore lancia questo incantesimo usando uno slot incantesimo di 3° livello o superiore, i punti ferita di un bersaglio aumentano di altri 5 punti per ogni slot di livello superiore al 2°."
  },
  {
    "id": "extra_allarme_2024",
    "nome": "Allarme",
    "livello": 1,
    "edizione": "2024",
    "scuola": "Abiurazione",
    "tempo_lancio": "1 minuto",
    "gittata": "9 metri",
    "durata": "8 ore",
    "rituale": true,
    "concentrazione": false,
    "comp": {
      "v": true,
      "s": true,
      "m": true
    },
    "materiali": "una campanella e un frammento di un sottile cavo d'argento",
    "classi": [
      "Mago",
      "Ranger"
    ],
    "descrizione": "L'incantatore predispone un allarme contro le visite indesiderate. Sceglie una porta, una finestra o un'area entro gittata che non sia più grande di un cubo con spigolo di 6 metri. Finché l'incantesimo non termina, un allarme avverte l'incantatore ogni volta che una creatura di taglia Minuscola o superiore tocca l'area protetta o vi entra.\nAl momento del lancio dell'incantesimo, l'incantatore designa quali creature non faranno scattare l'allarme. Sceglie inoltre se l'allarme è mentale o udibile. Un allarme mentale fa scattare un suono nella mente dell'incantatore se questi si trova entro 1,5 km dall'area protetta. Questo suono lo sveglia se sta dormendo. Un allarme udibile genera il suono di una campana per 10 secondi entro 18 metri.",
    "livelli_superiori": ""
  },
  {
    "id": "extra_allucinazione_mortale_2024",
    "nome": "Allucinazione Mortale",
    "livello": 4,
    "edizione": "2024",
    "scuola": "Illusione",
    "tempo_lancio": "1 azione",
    "gittata": "36 metri",
    "durata": "Concentrazione, fino a 1 minuto",
    "rituale": false,
    "concentrazione": true,
    "comp": {
      "v": true,
      "s": true,
      "m": false
    },
    "materiali": "",
    "classi": [
      "Mago"
    ],
    "descrizione": "L'incantatore attinge agli incubi di una creatura entro gittata e che egli sia in grado di vedere, per creare una manifestazione illusoria delle sue paure più recondite, visibile soltanto a quella creatura. Il bersaglio deve effettuare un tiro salvezza su Saggezza. Se lo fallisce, diventa spaventato per la durata dell'incantesimo. Alla fine di ogni turno del bersaglio prima che l'incantesimo termini, il bersaglio deve superare un tiro salvezza su Saggezza, altrimenti subirà 4d10 danni psichici. Se lo supera, l'incantesimo termina.",
    "livelli_superiori": "Quando l'incantatore lancia questo incantesimo usando uno slot incantesimo di 5° livello o superiore, i danni aumentano di 1d10 per ogni slot di livello superiore al 4°."
  },
  {
    "id": "extra_amicizia_2024",
    "nome": "Amicizia",
    "livello": 0,
    "edizione": "2024",
    "scuola": "Ammaliamento",
    "tempo_lancio": "1 azione",
    "gittata": "Incantatore",
    "durata": "Concentratone, fino a 1 minuto",
    "rituale": false,
    "concentrazione": true,
    "comp": {
      "v": false,
      "s": true,
      "m": true
    },
    "materiali": "una piccola quantit&agrave; di trucco da applicare al volto mentre si lancia l'incantesiino",
    "classi": [
      "Bardo",
      "Mago",
      "Stregone",
      "Warlock"
    ],
    "descrizione": "Per la durata dell'incantesimo, l'incantatore dispone di vantaggio a tutte le prove di Carisma rivolte a una creatura a sua scelta che non sia ostile nei suoi confronti. Quando l'incantesimo termina, la creatura capisce che l'incantatore ha usato la magia per influenzare il suo umore e potrebbe diventare ostile nei suoi confronti. Se la creatura è tendente alla violenza, potrebbe attaccarlo. Un'altra creatura potrebbe cercare vendetta in altri modi (a discrezione del DM), in base alla natura delle sue interazioni con l'incantatore.",
    "livelli_superiori": ""
  },
  {
    "id": "extra_anatema_2024",
    "nome": "Anatema",
    "livello": 1,
    "edizione": "2024",
    "scuola": "Ammaliamento",
    "tempo_lancio": "1 azione",
    "gittata": "9 metri",
    "durata": "Concentrazione, fino a 1 minuto",
    "rituale": false,
    "concentrazione": true,
    "comp": {
      "v": true,
      "s": true,
      "m": true
    },
    "materiali": "una goccia di sangue",
    "classi": [
      "Bardo",
      "Chierico"
    ],
    "descrizione": "L'incantatore sceglie fino a tre creature entro gittata e che egli sia in grado di vedere, che dovranno effettuare un tiro salvezza su Carisma. Se una creatura fallisce il suo tiro salvezza, ogni volta che effettua un tiro per colpire o un tiro salvezza prima che l'incantesimo termini deve tirare un d4 e sottrarre il numero ottenuto dal tiro per colpire o dal tiro salvezza.",
    "livelli_superiori": "Quando l'incantatore lancia questo incantesimo usando uno slot incantesimo di 2° livello o superiore, può bersagliare una creatura aggiuntiva per ogni slot di livello superiore al 1°."
  },
  {
    "id": "extra_animare_morti_2024",
    "nome": "Animare Morti",
    "livello": 3,
    "edizione": "2024",
    "scuola": "Necromanzia",
    "tempo_lancio": "1 minuto",
    "gittata": "3 metri",
    "durata": "Istantanea",
    "rituale": false,
    "concentrazione": false,
    "comp": {
      "v": true,
      "s": true,
      "m": true
    },
    "materiali": "una goccia di sangue, un brandello di carne, un pizzico di polvere d'osso",
    "classi": [
      "Mago",
      "Chierico"
    ],
    "descrizione": "Questo incantesimo crea un servitore non morto, scegliendo un cadavere di umanoide Medio o Piccolo entro gittata. Il suo incantesimo infonde nel bersaglio un'empia parvenza di vita, animandolo come creatura non morta. Il bersaglio diventa uno scheletro se l'incantatore ha scelto le ossa o uno zombi se ha scelto un cadavere. (Il DM possiede le statistiche di gioco di queste creature.)\nA ogni suo turno l'incantatore può usare un'azione bonus per comandare mentalmente qualsiasi creatura da lui creata tramite questo incantesimo e situata entro 18 metri da lui (se controlla più creature, può comandarle tutte o nessuna allo stesso tempo, impartendo lo stesso comando a ogni creatura). L'incantatore decide quale azione effettuerà la creatura e dove si muoverà durante il suo turno successivo, oppure può impartire un comando generale, come per esempio vigilare su una camera o un corridoio in particolare. Se l'incantatore non impartisce alcun comando, la creatura si limita a difendersi dalle creature ostili. Una volta ricevuto un ordine, la creatura continua a seguirlo finché non ha portato a termine il compito.\nLa creatura rimane sotto il controllo dell'incantatore per 24 ore, dopodiché smette di obbedire ai comandi che l'incantatore le ha impartito. Per mantenere il controllo della creatura per altre 24 ore, l'incantatore deve lanciare di nuovo questo incantesimo su di essa prima che l'attuale periodo di 24 ore termini. Questo uso dell'incantesimo gli permette di ristabilire il controllo su un massimo di quattro creature da lui animate tramite questo incantesimo, anziché animarne una nuova.",
    "livelli_superiori": "Quando l'incantatore lancia questo incantesimo usando uno slot incantesimo di 4° livello o superiore, anima o ristabilisce il controllo su due creature non morte aggiuntive per ogni slot di livello superiore al 3°. Ognuna di queste creature deve provenire da un cumulo di ossa o da un cadavere diverso."
  },
  {
    "id": "extra_animare_oggetti_2024",
    "nome": "Animare Oggetti",
    "livello": 5,
    "edizione": "2024",
    "scuola": "Trasmutazione",
    "tempo_lancio": "1 azione",
    "gittata": "36 metri",
    "durata": "Concentrazione, fino a 1 minuto",
    "rituale": false,
    "concentrazione": true,
    "comp": {
      "v": true,
      "s": true,
      "m": false
    },
    "materiali": "",
    "classi": [
      "Bardo",
      "Mago",
      "Stregone"
    ],